0000009c,63,"夏休み最後の夜。
今年も、何事もなく夏休みが終わろうとしている。","","",""
00000108,130,"海にも行かず、山にも行かず、アミューズメントパーク
とやらにも行かず…。思い返せば思い返すほど、
何もない…つまらない夏休みだった。","","",""
000001b8,118,"なぁに…どうせどこへ行ったところでカップルだらけ
だし、人混みも苦手だ。近場でだらだらと過ごした方が
正解に決まってる！","","",""
0000025c,104,"…のはずなのだが、女の子と一緒なら、
そんな状況も変わってたんじゃないのか…そんな疑念が
頭から離れない。","","",""
000002f4,100,"どんな人混みでも、どんなに甘ったるい場所でも、
女の子と２人で行けば楽しく過ごせた…
そんな気がする。","","",""
00000388,73,"思い切って誰かを誘ったり、現地調達…とやらに
挑戦するべきだっただろうか？","","",""
00000400,61,"結果はともあれ、何事もない夏休みってのは避けられた
気がする。","","",""
0000046c,86,"あ～あ、今さらだよな。
結局、何にもしなかったんだから仕方ない。
夏休みは終わったんだ。","","",""
